{
  "schema_version": "1.0.0",
  "tool_version": "1.0.0",
  "environment": {
    "generated_at_unix_seconds": 1800000000,
    "hostname": "fixture-host",
    "home": "/Users/fixture",
    "tool_versions": {}
  },
  "payload": {
    "capacity": [
      {
        "status": "measured",
        "kind": "volume_used",
        "bytes": 4096,
        "basis": "attr_vol_space_used"
      }
    ],
    "regions": [
      {
        "id": "capacity",
        "status": "complete"
      }
    ],
    "findings": [],
    "coverage_gaps": [
      {
        "id": "p1.toolchain_adapters",
        "plane": "toolchain_attribution",
        "region": "toolchain_adapters",
        "status": "unmeasurable",
        "reason": "no_adapters_compiled"
      }
    ]
  }
}
